PART-Article,Data
PART I - 1,"Name and territory of the Union.—(1) India, that is Bharat, shall bea Union of States.(2) The States and the territories thereof shall be as specified in the FirstSchedule.(3) The territory of India shall comprise—(a) the territories of the States;(b) the Union territories specified in the First Schedule; and(c) such other territories as may be acquired."
PART I - 2,"Admission or establishment of new States.—Parliament may by lawadmit into the Union, or establish, new States on such terms and conditions as itthinks fit."
PART I - 2A,"[Sikkim to be associated with the Union.] Rep. by the Constitution(Thirty- sixth Amendment) Act, 1975, s. 5 (w.e.f. 26-4-1975)."
PART I - 3,"Formation of new States and alteration of areas, boundaries ornames of existing States.—Parliament may by law—(a)form a new State by separation of territory from any State or byuniting two or more States or parts of States or by uniting any territory toa part of any State;(b) increase the area of any State;(c) diminish the area of any State;(d) alter the boundaries of any State;(e) alter the name of any State:Provided that no Bill for the purpose shall be introduced in either Houseof Parliament except on the recommendation of the President and unless, wherethe proposal contained in the Bill affects the area, boundaries or name of any ofthe States, the Bill has been referred by the President to the Legislature of thatState for expressing its views thereon within such period as may be specified inthe reference or within such further period as the President may allow and theperiod so specified or allowed has expired.23Explanation I.—In this article, in clauses (a) to (e), “State” includes aUnion territory, but in the proviso, “State” does not include a Union territory.Explanation II.—The power conferred on Parliament by clause (a)includes the power to form a new State or Union territory by uniting a part ofany State or Union territory to any other State or Union territory."
PART I - 4,"Laws made under articles 2 and 3 to provide for the amendmentof the First and the Fourth Schedules and supplemental, incidental andconsequential matters.—(1) Any law referred to in article 2 or article 3 shallcontain such provisions for the amendment of the First Schedule and the FourthSchedule as may be necessary to give effect to the provisions of the law andmay also contain such supplemental, incidental and consequential provisions(including provisions as to representation in Parliament and in the Legislatureor Legislatures of the State or States affected by such law) as Parliament maydeem necessary.(2) No such law as aforesaid shall be deemed to be an amendment of thisConstitution for the purposes of article 368."
PART II - 5,"Citizenship at the commencement of the Constitution.—At thecommencement of this Constitution, every person who has his domicile in theterritory of India and—(a) who was born in the territory of India; or(b) either of whose parents was born in the territory of India; or(c) who has been ordinarily resident in the territory of India fornot less than five years immediately preceding such commencement,shall be a citizen of India."
PART II - 6,"Rights of citizenship of certain persons who have migrated toIndia from Pakistan.—Notwithstanding anything in article 5, a person whohas migrated to the territory of India from the territory now included inPakistan shall be deemed to be a citizen of India at the commencement of thisConstitution if—(a) he or either of his parents or any of his grand-parents was bornin India as defined in the Government of India Act, 1935 (as originallyenacted); and(b)(i) in the case where such person has so migrated before thenineteenth day of July, 1948, he has been ordinarily resident in theterritory of India since the date of his migration, or(ii) in the case where such person has so migrated on or after thenineteenth day of July, 1948, he has been registered as a citizen of Indiaby an officer appointed in that behalf by the Government of theDominion of India on an application made by him therefore to suchofficer before the commencement of this Constitution in the form andmanner prescribed by that Government:Provided that no person shall be so registered unless he has been residentin the territory of India for at least six months immediately preceding the dateof his application.45"
PART II - 7,"Rights of citizeship of certain migrants to Pakistan.—Notwithstanding anything in articles 5 and 6, a person who has after the firstday of March, 1947, migrated from the territory of India to the territory nowincluded in Pakistan shall not be deemed to be a citizen of India:Provided that nothing in this article shall apply to a person who, afterhaving so migrated to the territory now included in Pakistan, has returned to theterritory of India under a permit for resettlement or permanent return issued byor under the authority of any law and every such person shall for the purposesof clause (b) of article 6 be deemed to have migrated to the territory of Indiaafter the nineteenth day of July, 1948."
PART II - 8,"Rights of citizenship of certain persons of Indian origin residingoutside India.—Notwithstanding anything in article 5, any person who oreither of whose parents or any of whose grand-parents was born in India asdefined in the Government of India Act, 1935 (as originally enacted), and whois ordinarily residing in any country outside India as so defined shall be deemedto be a citizen of India if he has been registered as a citizen of India by thediplomatic or consular representative of India in the country where he is for thetime being residing on an application made by him therefor to such diplomaticor consular representative, whether before or after the commencement of thisConstitution, in the form and manner prescribed by the Government of theDominion of India or the Government of India."
PART II - 9,"Persons voluntarily acquiring citizenship of a foreign State not tobe citizens.— No person shall be a citizen of India by virtue of article 5, or bedeemed to be a citizen of India by virtue of article 6 or article 8, if he hasvoluntarily acquired the citizenship of any foreign State."
PART II - 10,"Continuance of the rights of citizenship.—Every person who is oris deemed to be a citizen of India under any of the foregoing provisions of thisPart shall, subject to the provisions of any law that may be made by Parliament,continue to be such citizen."
PART II - 11,Parliament to regulate the right of citizenship by law.—Nothingin the foregoing provisions of this Part shall derogate from the power ofParliament to make any provision with respect to the acquisition andtermination of citizenship and all other matters relating to citizenship.
PART III - 12,"Definition.—In this Part, unless the context otherwise requires, “theState” includes the Government and Parliament of India and the Governmentand the Legislature of each of the States and all local or other authorities withinthe territory of India or under the control of the Government of India."
PART III - 13,"Laws inconsistent with or in derogation of the fundamentalrights.—(1) All laws in force in the territory of India immediately before thecommencement of this Constitution, in so far as they are inconsistent with theprovisions of this Part, shall, to the extent of such inconsistency, be void.(2) The State shall not make any law which takes away or abridges therights conferred by this Part and any law made in contravention of this clauseshall, to the extent of the contravention, be void.(3) In this article, unless the context otherwise requires,—(a) “law” includes any Ordinance, order, bye-law, rule, regulation,notification, custom or usage having in the territory of India the force oflaw;(b) “laws in force” includes laws passed or made by a Legislatureor other competent authority in the territory of India before thecommencement of this Constitution and not previously repealed,notwithstanding that any such law or any part thereof may not be then inoperation either at all or in particular areas.(4) Nothing in this article shall apply to any amendment of thisConstitution made under article 368.Right to Equality"
PART III - 14,Equality before law.—The State shall not deny to any personequality before the law or the equal protection of the laws within the territory ofIndia.
PART III - 15,"Prohibition of discrimination on grounds of religion, race, caste,sex or place of birth.—(1) The State shall not discriminate against any citizenon grounds only of religion, race, caste, sex, place of birth or any of them.(2) No citizen shall, on grounds only of religion, race, caste, sex, place ofbirth or any of them, be subject to any disability, liability, restriction orcondition with regard to—(a) access to shops, public restaurants, hotels and places of publicentertainment; or67(b) the use of wells, tanks, bathing ghats, roads and places ofpublic resort maintained wholly or partly out of State funds or dedicatedto the use of the general public.(3) Nothing in this article shall prevent the State from making anyspecial provision for women and children.(4) Nothing in this article or in clause (2) of article 29 shall prevent theState from making any special provision for the advancement of any sociallyand educationally backward classes of citizens or for the Scheduled Castes andthe Scheduled Tribes.(5) Nothing in this article or in sub-clause (g) of clause (1) of article 19shall prevent the State from making any special provision, by law, for theadvancement of any socially and educationally backward classes of citizens orfor the Scheduled Castes or the Scheduled Tribes in so far as such specialprovisions relate to their admission to educational institutions including privateeducational institutions, whether aided or unaided by the State, other than theminority educational institutions referred to in clause (1) of article 30.(6) Nothing in this article or sub-clause (g) of clause (1) of article 19 or clause (2)of article 29 shall prevent the State from making,—(a) any special provision for the advancement of any economically weakersections of citizens other than the classes mentioned in clauses (4) and (5); and(b) any special provision for the advancement of any economically weakersections of citizens other than the classes mentioned in clauses (4) and (5) in sofar as such special provisions relate to their admission to educational institutionsincluding private educational institutions, whether aided or unaided by theState, other than the minority educational institutions referred to in clause (1) ofarticle 30, which in the case of reservation would be in addition to the existingreservations and subject to a maximum of ten per cent. of the total seats in eachcategory.Explanation.—For the purposes of this article and article 16, ""economicallyweaker sections"" shall be such as may be notified by the State from time to timeon the basis of family income and other indicators of economic disadvantage."
PART III - 16,"Equality of opportunity in matters of public employment.—(1)There shall be equality of opportunity for all citizens in matters relating toemployment or appointment to any office under the State.(2) No citizen shall, on grounds only of religion, race, caste, sex, descent,place of birth, residence or any of them, be ineligible for, or discriminated againstin respect of, any employment or office under the State.(3) Nothing in this article shall prevent Parliament from making any lawprescribing, in regard to a class or classes of employment or appointment to anoffice under the Government of, or any local or other authority within, a Stateor Union territory, any requirement as to residence within that State or Unionterritory prior to such employment or appointment.(4) Nothing in this article shall prevent the State from making anyprovision for the reservation of appointments or posts in favour of anybackward class of citizens which, in the opinion of the State, is not adequatelyrepresented in the services under the State.(4A) Nothing in this article shall prevent the State from making anyprovision for reservation in matters of promotion, with consequential seniority,to any class or classes of posts in the services under the State in favour of theScheduled Castes and the Scheduled Tribes which, in the opinion of the State,are not adequately represented in the services under the State.8(4B) Nothing in this article shall prevent the State from considering anyunfilled vacancies of a year which are reserved for being filled up in that yearin accordance with any provision for reservation made under clause (4) orclause (4A) as a separate class of vacancies to be filled up in any succeedingyear or years and such class of vacancies shall not be considered together withthe vacancies of the year in which they are being filled up for determining theceiling of fifty per cent. reservation on total number of vacancies of that year.(5) Nothing in this article shall affect the operation of any law whichprovides that the incumbent of an office in connection with the affairs of anyreligious or denominational institution or any member of the governing bodythereof shall be a person professing a particular religion or belonging to aparticular denomination.(6) Nothing in this article shall prevent the State from making any provisionfor the reservation of appointments or posts in favour of any economically weakersections of citizens other than the classes mentioned in clause (4), in addition to theexisting reservation and subject to a maximum of ten per cent. of the posts in eachcategory"
PART III - 17,Abolition of Untouchability.—“Untouchability” is abolished and itspractice in any form is forbidden. The enforcement of any disability arising outof “Untouchability” shall be an offence punishable in accordance with law.
PART III - 18,"Abolition of titles.—(1) No title, not being a military or academicdistinction, shall be conferred by the State.(2) No citizen of India shall accept any title from any foreign State.(3) No person who is not a citizen of India shall, while he holds anyoffice of profit or trust under the State, accept without the consent of thePresident any title from any foreign State.(4) No person holding any office of profit or trust under the State shall,without the consent of the President, accept any present, emolument, or officeof any kind from or under any foreign State.Right to Freedom"
PART III - 19,"Protection of certain rights regarding freedom of speech, etc.—(1) All citizens shall have the right—(a) to freedom of speech and expression;(b) to assemble peaceably and without arms;(c) to form associations or unions, co-operative societies;(d) to move freely throughout the territory of India;9(e) to reside and settle in any part of the territory of India; and*****(g) to practise any profession, or to carry on any occupation, trade orbusiness.(2) Nothing in sub-clause (a) of clause (1) shall affect the operation ofany existing law, or prevent the State from making any law, in so far as suchlaw imposes reasonable restrictions on the exercise of the right conferred by thesaid sub-clause in the interests of the sovereignty and integrity of India, thesecurity of the State, friendly relations with foreign States, public order,decency or morality, or in relation to contempt of court, defamation orincitement to an offence.(3) Nothing in sub-clause (b) of the said clause shall affect the operationof any existing law in so far as it imposes, or prevent the State from makingany law imposing, in the interests of the sovereignty and integrity of India orpublic order, reasonable restrictions on the exercise of the right conferred bythe said sub-clause.(4) Nothing in sub-clause (c) of the said clause shall affect the operationof any existing law in so far as it imposes, or prevent the State from makingany law imposing, in the interests of the sovereignty and integrity of India orpublic order or morality, reasonable restrictions on the exercise of the rightconferred by the said sub-clause.(5) Nothing in sub-clauses (d) and (e) of the said clause shall affect theoperation of any existing law in so far as it imposes, or prevent the State frommaking any law imposing, reasonable restrictions on the exercise of any of therights conferred by the said sub-clauses either in the interests of the generalpublic or for the protection of the interests of any Scheduled Tribe.(6) Nothing in sub-clause (g) of the said clause shall affect the operationof any existing law in so far as it imposes, or prevent the State from makingany law imposing, in the interests of the general public, reasonable restrictionson the exercise of the right conferred by the said sub-clause, and, in particular,nothing in the said sub-clause shall affect the operation of any existing law inso far as it relates to, or prevent the State from making any law relating to,—(i) the professional or technical qualifications necessary for practisingany profession or carrying on any occupation, trade or business, or10(ii) the carrying on by the State, or by a corporation owned orcontrolled by the State, of any trade, business, industry or service,whether to the exclusion, complete or partial, of citizens or otherwise."
PART III - 20,"Protection in respect of conviction for offences.—(1) No personshall be convicted of any offence except for violation of a law in force at thetime of the commission of the Act charged as an offence, nor be subjected to apenalty greater than that which might have been inflicted under the law in forceat the time of the commission of the offence.(2) No person shall be prosecuted and punished for the same offencemore than once.(3) No person accused of any offence shall be compelled to be a witnessagainst himself."
PART III - 21,Protection of life and personal liberty.—No person shall bedeprived of his life or personal liberty except according to procedureestablished by law.
PART III - 21A,"Right to education.—The State shall provide free and compulsoryeducation to all children of the age of six to fourteen years in such manner asthe State may, by law, determine.1"
PART III - 22,"Protection against arrest and detention in certain cases.—(1) Noperson who is arrested shall be detained in custody without being informed, assoon as may be, of the grounds for such arrest nor shall he be denied the rightto consult, and to be defended by, a legal practitioner of his choice.(2) Every person who is arrested and detained in custody shall beproduced before the nearest magistrate within a period of twenty-four hours ofsuch arrest excluding the time necessary for the journey from the place of arrestto the court of the magistrate and no such person shall be detained in custodybeyond the said period without the authority of a magistrate.(3) Nothing in clauses (1) and (2) shall apply—(a) to any person who for the time being is an enemy alien; or______________________________________________11(b) to any person who is arrested or detained under any law providingfor preventive detention.(4) No law providing for preventive detention shall authorise thedetention of a person for a longer period than three months unless—(a) an Advisory Board consisting of persons who are, or have been,or are qualified to be appointed as, Judges of a High Court has reportedbefore the expiration of the said period of three months that there is in itsopinion sufficient cause for such detention:Provided that nothing in this sub-clause shall authorise the detentionof any person beyond the maximum period prescribed by any law madeby Parliament under sub-clause (b) of clause (7); or(b) such person is detained in accordance with the provisions of anylaw made by Parliament under sub-clauses (a) and (b) of clause (7).(5) When any person is detained in pursuance of an order made underany law providing for preventive detention, the authority making the ordershall, as soon as may be, communicate to such person the grounds on which theorder has been made and shall afford him the earliest opportunity of making arepresentation against the order.(6) Nothing in clause (5) shall require the authority making any suchorder as is referred to in that clause to disclose facts which such authorityconsiders to be against the public interest to disclose.(7) Parliament may by law prescribe—(a) the circumstances under which, and the class or classes of cases inwhich, a person may be detained for a period longer than three monthsunder any law providing for preventive detention without obtaining theopinion of an Advisory Board in accordance with the provisions of subclause (a) of clause (4);(b) the maximum period for which any person may in any class orclasses of cases be detained under any law providing for preventivedetention; and(c) the procedure to be followed by an Advisory Board in an inquiryunder sub-clause (a) of clause (4).12Right against Exploitation"
PART III - 23,"Prohibition of traffic in human beings and forced labour.—(1)Traffic in human beings and begar and other similar forms of forced labour areprohibited and any contravention of this provision shall be an offencepunishable in accordance with law.(2) Nothing in this article shall prevent the State from imposingcompulsory service for public purposes, and in imposing such service the Stateshall not make any discrimination on grounds only of religion, race, caste orclass or any of them."
PART III - 24,"Prohibition of employment of children in factories, etc.—No childbelow the age of fourteen years shall be employed to work in any factory ormine or engaged in any other hazardous employment.Right to Freedom of Religion"
PART III - 25,"Freedom of conscience and free profession, practice andpropagation of religion.—(1) Subject to public order, morality and health andto the other provisions of this Part, all persons are equally entitled to freedomof conscience and the right freely to profess, practise and propagate religion.(2) Nothing in this article shall affect the operation of any existing law orprevent the State from making any law—(a) regulating or restricting any economic, financial, political orother secular activity which may be associated with religious practice;(b) providing for social welfare and reform or the throwing openof Hindu religious institutions of a public character to all classes andsections of Hindus.Explanation I.—The wearing and carrying of kirpans shall be deemed tobe included in the profession of the Sikh religion.Explanation II.—In sub-clause (b) of clause (2), the reference to Hindusshall be construed as including a reference to persons professing the Sikh, Jainaor Buddhist religion, and the reference to Hindu religious institutions shall beconstrued accordingly."
PART III - 26,"Freedom to manage religious affairs.—Subject to public order,morality and health, every religious denomination or any section thereof shallhave the right—(a) to establish and maintain institutions for religious and charitablepurposes;13(b) to manage its own affairs in matters of religion;(c) to own and acquire movable and immovable property; and(d) to administer such property in accordance with law."
PART III - 27,"Freedom as to payment of taxes for promotion of any particularreligion.—No person shall be compelled to pay any taxes, the proceeds ofwhich are specifically appropriated in payment of expenses for the promotionor maintenance of any particular religion or religious denomination."
PART III - 28,"Freedom as to attendance at religious instruction or religiousworship in certain educational institutions.—(1) No religious instructionshall be provided in any educational institution wholly maintained out of Statefunds.(2) Nothing in clause (1) shall apply to an educational institution whichis administered by the State but has been established under any endowment ortrust which requires that religious instruction shall be imparted in suchinstitution.(3) No person attending any educational institution recognised by theState or receiving aid out of State funds shall be required to take part in anyreligious instruction that may be imparted in such institution or to attend anyreligious worship that may be conducted in such institution or in any premisesattached thereto unless such person or, if such person is a minor, his guardianhas given his consent thereto.Cultural and Educational Rights"
PART III - 29,"Protection of interests of minorities.—(1) Any section of thecitizens residing in the territory of India or any part thereof having a distinctlanguage, script or culture of its own shall have the right to conserve the same.(2) No citizen shall be denied admission into any educational institutionmaintained by the State or receiving aid out of State funds on grounds only ofreligion, race, caste, language or any of them."
PART III - 30,"Right of minorities to establish and administer educationalinstitutions.—(1) All minorities, whether based on religion or language, shallhave the right to establish and administer educational institutions of theirchoice.14(1A) In making any law providing for the compulsory acquisition of anyproperty of an educational institution established and administered by aminority, referred to in clause (1), the State shall ensure that the amount fixedby or determined under such law for the acquisition of such property is such aswould not restrict or abrogate the right guaranteed under that clause.(2) The State shall not, in granting aid to educational institutions,discriminate against any educational institution on the ground that it is underthe management of a minority, whether based on religion or language.****"
