PART-Article,Data
PART XVI - 332,"Reservation of seats for Scheduled Castes and Scheduled Tribesin the Legislative Assemblies of the States.—(1) Seats shall be reserved forthe Scheduled Castes and the Scheduled Tribes, except the Scheduled Tribes inthe autonomous districts of Assam, in the Legislative Assembly of every State.(2) Seats shall be reserved also for the autonomous districts in theLegislative Assembly of the State of Assam.(3) The number of seats reserved for the Scheduled Castes or theScheduled Tribes in the Legislative Assembly of any State under clause (1)shall bear, as nearly as may be, the same proportion to the total number of seatsin the Assembly as the population of the Scheduled Castes in the State or of theScheduled Tribes in the State or part of the State, as the case may be, in respectof which seats are so reserved, bears to the total population of the State.(3A) Notwithstanding anything contained in clause (3), until the takingeffect, under article 170, of the re-adjustment, on the basis of the first censusafter the year 2026, of the number of seats in the Legislative Assemblies of theStates of Arunachal Pradesh, Meghalaya, Mizoram and Nagaland, the seatswhich shall be reserved for the Scheduled Tribes in the Legislative Assemblyof any such State shall be,—(a) if all the seats in the Legislative Assembly of such State inexistence on the date of coming into force of the Constitution (Fiftyseventh Amendment) Act, 1987 (hereafter in this clause referred to asthe existing Assembly) are held by members of the Scheduled Tribes, allthe seats except one;(b) in any other case, such number of seats as bears to the totalnumber of seats, a proportion not less than the number (as on the saiddate) of members belonging to the Scheduled Tribes in the existingAssembly bears to the total number of seats in the existing Assembly.(3B) Notwithstanding anything contained in clause (3), until the readjustment, under article 170, takes effect on the basis of the first census afterthe year 2026, of the number of seats in the Legislative Assembly of the Stateof Tripura, the seats which shall be reserved for the Scheduled Tribes in theLegislative Assembly shall be, such number of seats as bears to the totalnumber of seats, a proportion not less than the number, as on the date ofcoming into force of the Constitution (Seventy-second Amendment) Act, 1992,of members belonging to the Scheduled Tribes in the Legislative Assembly inexistence on the said date bears to the total number of seats in that Assembly.167(4) The number of seats reserved for an autonomous district in theLegislative Assembly of the State of Assam shall bear to the total number ofseats in that Assembly a proportion not less than the population of the districtbears to the total population of the State.(5) The constituencies for the seats reserved for any autonomous districtof Assam shall not comprise any area outside that district.(6) No person who is not a member of a Scheduled Tribe of anyautonomous district of the State of Assam shall be eligible for election to theLegislative Assembly of the State from any constituency of that district:Provided that for elections to the Legislative Assembly of the State ofAssam, the representation of the Scheduled Tribes and non-Scheduled Tribes inthe constituencies included in the Bodoland Territorial Areas District, sonotified, and existing prior to the constitution of Bodoland Territorial AreasDistrict, shall be maintained."
PART XVI - 333,"Representation of the Anglo-Indian community in theLegislative Assemblies of the States.— Notwithstanding anything in article170, the Governor of a State may, if he is of opinion that the Anglo-Indiancommunity needs representation in the Legislative Assembly of the State and isnot adequately represented therein, nominate one member of that community tothe Assembly."
PART XVI - 334,"Reservation of seats and special representation to cease after certainperiod.—Notwithstanding anything in the foregoing provisions of thisPart, the provisions of this Constitution relating to—(a) the reservation of seats for the Scheduled Castes and theScheduled Tribes in the House of the People and in the LegislativeAssemblies of the States; and(b) the representation of the Anglo-Indian community in theHouse of the People and in the Legislative Assemblies of the States bynomination,shall cease to have effect on the expiration of a period of eighty years in respect of clause (a) and seventy years in respect ofclause (b) fromthe commencement of this Constitution:Provided that nothing in this article shall affect any representation in theHouse of the People or in the Legislative Assembly of a State until thedissolution of the then existing House or Assembly, as the case may be."
PART XVI - 335,"Claims of Scheduled Castes and Scheduled Tribes to servicesand posts.—The claims of the members of the Scheduled Castes and theScheduled Tribes shall be taken into consideration, consistently with themaintenance of efficiency of administration, in the making of appointments toservices and posts in connection with the affairs of the Union or of a State:168Provided that nothing in this article shall prevent in making of any provisionin favour of the members of the Scheduled Castes and the Scheduled Tribes forrelaxation in qualifying marks in any examination or lowering the standards ofevaluation, for reservation in matters or promotion to any class or classes of servicesor posts in connection with the affairs of the Union or of a State."
PART XVI - 336,"Special provision for Anglo-Indian community in certainservices.— (1) During the first two years after the commencement of thisConstitution, appointments of members of the Anglo-Indian community to postsin the railway, customs, postal and telegraph services of the Union shall be madeon the same basis as immediately before the fifteenth day of August, 1947.During every succeeding period of two years, the number of postsreserved for the members of the said community in the said services shall, asnearly as possible, be less by ten per cent. than the numbers so reserved duringthe immediately preceding period of two years:Provided that at the end of ten years from the commencement of thisConstitution all such reservations shall cease.(2) Nothing in clause (1) shall bar the appointment of members of theAnglo-Indian community to posts other than, or in addition to, those reservedfor the community under that clause if such members are found qualified forappointment on merit as compared with the members of other communities."
PART XVI - 337,"Special provision with respect to educational grants for thebenefit of Anglo-Indian community.—During the first three financial yearsafter the commencement of this Constitution, the same grants, if any, shall bemade by the Union and by each State for the benefit of the Anglo-Indiancommunity in respect of education as were made in the financial year endingon the thirty-first day of March, 1948.During every succeeding period of three years the grants may be less byten per cent. than those for the immediately preceding period of three years:Provided that at the end of ten years from the commencement of thisConstitution such grants, to the extent to which they are a special concession tothe Anglo-Indian community, shall cease:Provided further that no educational institution shall be entitled toreceive any grant under this article unless at least forty per cent. of the annualadmissions therein are made available to members of communities other thanthe Anglo-Indian community.169"
PART XVI - 338,"National Commission for Scheduled Castes.—(1) There shall bea Commission for the Scheduled Castes to be known as the NationalCommission for the Scheduled Castes.(2) Subject to the provisions of any law made in this behalf byParliament, the Commission shall consist of a Chairperson, Vice-Chairpersonand three other Members and the conditions of service and tenure of office ofthe Chairperson, Vice-Chairperson and other Members so appointed shall besuch as the President may by rule determine.(3) The Chairperson, Vice-Chairperson and other Members of theCommission shall be appointed by the President by warrant under his hand and seal.(4) The Commission shall have the power to regulate its own procedure.(5) It shall be the duty of the Commission—(a) to investigate and monitor all matters relating to the safeguardsprovided for the Scheduled Castes under this Constitution or under anyother law for the time being in force or under any order of theGovernment and to evaluate the working of such safeguards;(b) to inquire into specific complaints with respect to thedeprivation of rights and safeguards of the Scheduled Castes;(c) to participate and advise on the planning process of socioeconomic development of the Scheduled Castes and to evaluate theprogress of their development under the Union and any State;(d) to present to the President, annually and at such other times as theCommission may deem fit, reports upon the working of those safeguards;(e) to make in such reports recommendations as to the measures thatshould be taken by the Union or any State for the effective implementation ofthose safeguards and other measures for the protection, welfare and socioeconomic development of the Scheduled Castes; and(f) to discharge such other functions in relation to the protection,welfare and development and advancement of the Scheduled Castes asthe President may, subject to the provisions of any law made byParliament, by rule specify.(6) The President shall cause all such reports to be laid before eachHouse of Parliament along with a memorandum explaining the action taken orproposed to be taken on the recommendations relating to the Union and thereasons for the non-acceptance, if any, of any of such recommendations.170(7) Where any such report, or any part thereof, relates to any matter withwhich any State Government is concerned, a copy of such report shall beforwarded to the Governor of the State who shall cause it to be laid before theLegislature of the State along with a memorandum explaining the action takenor proposed to be taken on the recommendations relating to the State and thereasons for the non-acceptance, if any, of any of such recommendations.(8) The Commission shall, while investigating any matter referred to insub-clause (a) or inquiring into any complaint referred to in sub-clause (b) ofclause (5), have all the powers of a civil court trying a suit and in particular inrespect of the following matters, namely :—(a) summoning and enforcing the attendance of any person fromany part of India and examining him on oath;(b) requiring the discovery and production of any document;(c) receiving evidence on affidavits;(d) requisitioning any public record or copy thereof from anycourt or office;(e) issuing commissions for the examination of witnesses anddocuments;(f) any other matter which the President may, by rule, determine.(9) The Union and every State Government shall consult theCommission on all major policy matters affecting Scheduled Castes.(10) In this article, references to the Scheduled Castes shall be construedas including references to the Anglo-Indian community."
PART XVI - 338A,"National Commission for Scheduled Tribes.—(1) There shallbe a Commission for the Scheduled Tribes to be known as the NationalCommission for the Scheduled Tribes.(2) Subject to the provisions of any law made in this behalf byParliament, the Commission shall consist of a Chairperson, Vice-Chairpersonand three other Members and the conditions of service and tenure of office ofthe Chairperson, Vice-Chairperson and other Members so appointed shall besuch as the President may by rule determine.171(3) The Chairperson, Vice-Chairperson and other Members of theCommission shall be appointed by the President by warrant under his hand and seal.(4) The Commission shall have the power to regulate its own procedure.(5) It shall be the duty of the Commission—(a) to investigate and monitor all matters relating to thesafeguards provided for the Scheduled Tribes under this Constitution orunder any other law for the time being in force or under any order of theGovernment and to evaluate the working of such safeguards;(b) to inquire into specific complaints with respect to thedeprivation of rights and safeguards of the Scheduled Tribes;(c) to participate and advise on the planning process of socioeconomic development of the Scheduled Tribes and to evaluate theprogress of their development under the Union and any State;(d) to present to the President, annually and at such other times asthe Commission may deem fit, reports upon the working of thosesafeguards;(e) to make in such reports recommendation as to themeasures that should be taken by the Union or any State for theeffective implementation of those safeguards and other measuresfor the protection, welfare and socio-economic development of theScheduled Tribes; and(f) to discharge such other functions in relation to the protection,welfare and development and advancement of the Scheduled Tribes asthe President may, subject to the provisions of any law made byParliament, by rule specify.(6) The President shall cause all such reports to be laid before eachHouse of Parliament along with a memorandum explaining the action taken orproposed to be taken on the recommendations relating to the Union and thereasons for the non-acceptance, if any, of any such recommendations.(7) Where any such report, or any part thereof, relates to any matterwith which any State Government is concerned, a copy of such report shall beforwarded to the Governor of the State who shall cause it to be laid before theLegislature of the State along with a memorandum explaining the action takenor proposed to be taken on the recommendations relating to the State and thereasons for the non-acceptance, if any, of any of such recommendations.172(8) The Commission shall, while investigating any matter referred to insub-clause (a) or inquiring into any complaint referred to in sub-clause (b) ofclause (5), have all the powers of a civil court trying a suit and in particular inrespect of the following matters, namely:—(a) Summoning and enforcing the attendance of any person fromany part of India and examining him on oath;(b) requiring the discovery and production of any document;(c) receiving evidence on affidavits;(d) requisitioning any public record or copy thereof from anycourt or office;(e) issuing commissions for the examination of witnesses and documents;(f) any other matter which the President may, by rule, determine.(9) The Union and every State Government shall consult theCommission on all major policy matters affecting Scheduled Tribes."
PART XVI - 338B,"(1) There shall be a Commission for the socially and educationallybackward classes to be known as the National Commission for Backward Classes.(2) Subject to the provisions of any law made in this behalf by Parliament, theCommission shall consist of a Chairperson, Vice-Chairperson and three other Membersand the conditions of service and tenure of office of the Chairperson, Vice-Chairpersonand other Members so appointed shall be such as the President may by rule determine.(3) The Chairperson, Vice-Chairperson and other Members of the Commissionshall be appointed by the President by warrant under his hand and seal.(4) The Commission shall have the power to regulate its own procedure.(5) It shall be the duty of the Commission—(a) to investigate and monitor all matters relating to the safeguards providedfor the socially and educationally backward classes under this Constitution orunder any other law for the time being in force or under any order of theGovernment and to evaluate the working of such safeguards;(b) to inquire into specific complaints with respect to the deprivation ofrights and safeguards of the socially and educationally backward classes;(c) to participate and advise on the socio-economic development of thesocially and educationally backward classes and to evaluate the progress oftheir development under the Union and any State;(d) to present to the President, annually and at such other times as theCommission may deem fit, reports upon the working of those safeguards;(e) to make in such reports the recommendations as to the measures thatshould be taken by the Union or any State for the effective implementation ofthose safeguards and other measures for the protection, welfare andsocio-economic development of the socially and educationally backward classes;and(f ) to discharge such other functions in relation to the protection, welfareand development and advancement of the socially and educationally backwardclasses as the President may, subject to the provisions of any law made byParliament, by rule specify.(6) The President shall cause all such reports to be laid before each House ofParliament along with a memorandum explaining the action taken or proposed to betaken on the recommendations relating to the Union and the reasons for the non-acceptance, if any, of any of such recommendations.(7) Where any such report, or any part thereof, relates to any matter with whichany State Government is concerned, a copy of such report shall be forwarded to theState Government which shall cause it to be laid before the Legislature of the Statealong with a memorandum explaining the action taken or proposed to be taken on therecommendations relating to the State and the reasons for the non-acceptance, if any,of any of such recommendations.(8) The Commission shall, while investigating any matter referred to insub-clause (a) or inquiring into any complaint referred to in sub-clause (b) of clause (5),have all the powers of a civil court trying a suit and in particular in respect of thefollowing matters, namely:—(a) summoning and enforcing the attendance of any person from any partof India and examining him on oath;(b) requiring the discovery and production of any document;(c) receiving evidence on affidavits;(d) requisitioning any public record or copy thereof from any court oroffice;(e) issuing commissions for the examination of witnesses and documents;(f) any other matter which the President may, by rule, determine.(9) The Union and every State Government shall consult the Commission on allmajor policy matters affecting the socially and educationally backward classes."
PART XVI - 339,"Control of the Union over the administration of ScheduledAreas and the welfare of Scheduled Tribes.—(1) The President may at anytime and shall, at the expiration of ten years from the commencement of thisConstitution by order appoint a Commission to report on the administration ofthe Scheduled Areas and the welfare of the Scheduled Tribes in the States.The order may define the composition, powers and procedure of theCommission and may contain such incidental or ancillary provisions as thePresident may consider necessary or desirable.(2) The executive power of the Union shall extend to the giving ofdirections to a State as to the drawing up and execution of schemes specified inthe direction to be essential for the welfare of the Scheduled Tribes in the State."
PART XVI - 340,"Appointment of a Commission to investigate the conditions ofbackward classes.—(1) The President may by order appoint a Commissionconsisting of such persons as he thinks fit to investigate the conditions ofsocially and educationally backward classes within the territory of India and thedifficulties under which they labour and to make recommendations as to thesteps that should be taken by the Union or any State to remove such difficultiesand to improve their condition and as to the grants that should be made for thepurpose by the Union or any State and the conditions subject to which suchgrants should be made, and the order appointing such Commission shall definethe procedure to be followed by the Commission.173(2) A Commission so appointed shall investigate the matters referred tothem and present to the President a report setting out the facts as found by themand making such recommendations as they think proper.(3) The President shall cause a copy of the report so presented togetherwith a memorandum explaining the action taken thereon to be laid before eachHouse of Parliament."
PART XVI - 341,"Scheduled Castes.—(1) The President may with respect to anyState or Union territory, and where it is a State, after consultation with theGovernor thereof, by public notification, specify the castes, races or tribes orparts of or groups within castes, races or tribes which shall for the purposes ofthis Constitution be deemed to be Scheduled Castes in relation to that State orUnion territory, as the case may be.(2) Parliament may by law include in or exclude from the list ofScheduled Castes specified in a notification issued under clause (1) any caste,race or tribe or part of or group within any caste, race or tribe, but save asaforesaid a notification issued under the said clause shall not be varied by anysubsequent notification."
PART XVI - 342,"Scheduled Tribes.—(1) The President may with respect to anyState or Union territory, and where it is a State, after consultation with theGovernor thereof, by public notification, specify the tribes or tribalcommunities or parts of or groups within tribes or tribal communities whichshall for the purposes of this Constitution be deemed to be Scheduled Tribes inrelation to that State or Union territory, as the case may be.(2) Parliament may by law include in or exclude from the list ofScheduled Tribes specified in a notification issued under clause (1) any tribe ortribal community or part of or group within any tribe or tribal community, butsave as aforesaid a notification issued under the said clause shall not be variedby any subsequent notification.342A. (1) The President may with respect to any State or Union territory, andwhere it is a State, after consultation with the Governor thereof, by public notification,specify the socially and educationally backward classes which shall for the purposesof this Constitution be deemed to be socially and educationally backward classes inrelation to that State or Union territory, as the case may be.(2) Parliament may by law include in or exclude from the Central List of sociallyand educationally backward classes specified in a notification issued under clause (1)any socially and educationally backward class, but save as aforesaid a notificationissued under the said clause shall not be varied by any subsequent notification"
PART XVII - 343,"Official language of the Union.—(1) The official language of theUnion shall be Hindi in Devanagari script.The form of numerals to be used for the official purposes of the Unionshall be the international form of Indian numerals.(2) Notwithstanding anything in clause (1), for a period of fifteen yearsfrom the commencement of this Constitution, the English language shallcontinue to be used for all the official purposes of the Union for which it wasbeing used immediately before such commencement:Provided that the President may, during the said period, by orderauthorise the use of the Hindi language in addition to the English language andof the Devanagari form of numerals in addition to the international form ofIndian numerals for any of the official purposes of the Union.(3) Notwithstanding anything in this article, Parliament may by lawprovide for the use, after the said period of fifteen years, of—(a) the English language, or(b) the Devanagari form of numerals,for such purposes as may be specified in the law."
PART XVII - 344,"Commission and Committee of Parliament on officiallanguage.—(1) The President shall, at the expiration of five years from thecommencement of this Constitution and thereafter at the expiration of ten yearsfrom such commencement, by order constitute a Commission which shallconsist of a Chairman and such other members representing the differentlanguages specified in the Eighth Schedule as the President may appoint, andthe order shall define the procedure to be followed by the Commission.(2) It shall be the duty of the Commission to make recommendations tothe President as to—(a) the progressive use of the Hindi language for the officialpurposes of the Union;(b) restrictions on the use of the English language for all or any ofthe official purposes of the Union;(c) the language to be used for all or any of the purposesmentioned in article 348;174175(d) the form of numerals to be used for any one or more specifiedpurposes of the Union;(e) any other matter referred to the Commission by the Presidentas regards the official language of the Union and the language forcommunication between the Union and a State or between one State andanother and their use.(3) In making their recommendations under clause (2), the Commissionshall have due regard to the industrial, cultural and scientific advancement ofIndia, and the just claims and the interests of persons belonging to the nonHindi speaking areas in regard to the public services.(4) There shall be constituted a Committee consisting of thirty members,of whom twenty shall be members of the House of the People and ten shall bemembers of the Council of States to be elected respectively by the members ofthe House of the People and the members of the Council of States inaccordance with the system of proportional representation by means of thesingle transferable vote.(5) It shall be the duty of the Committee to examine therecommendations of the Commission constituted under clause (1) and to reportto the President their opinion thereon.(6) Notwithstanding anything in article 343, the President may, afterconsideration of the report referred to in clause (5), issue directions inaccordance with the whole or any part of that report.CHAPTER II.—REGIONAL LANGUAGES"
